{
  "schemaVersion": "4.0.0",
  "profile": "standard",
  "metadata": {
    "name": "Core Design System Algorithms Collection",
    "description": "A comprehensive set of algorithms for the core design system",
    "author": "Design System Team",
    "version": "1.0.0"
  },
  "config": {
    "baseUnit": 16,
    "scaleFactor": 1.25,
    "precision": 2
  },
  "algorithms": [
    {
      "id": "core-typescale-algorithm",
      "name": "Core Typography Scale Algorithm",
      "description": "Calculates font size based on modular scale for core design system",
      "resolvedValueTypeId": "font-size",
      "variables": [
        {
          "id": "var_base",
          "name": "Base",
          "type": "number",
          "defaultValue": "16"
        },
        {
          "id": "var_ratio",
          "name": "Ratio",
          "type": "number",
          "defaultValue": "1.25"
        }
      ],
      "formulas": [
        {
          "id": "formula-typescale",
          "name": "Type Scale",
          "expressions": {
            "latex": {
              "value": "\\mathit{Base} \\times \\mathit{Ratio}^{n}"
            },
            "javascript": {
              "value": "Base * Math.pow(Ratio, n)",
              "metadata": {
                "allowedOperations": [
                  "math"
                ]
              }
            },
            "ast": {
              "type": "binary",
              "operator": "*",
              "left": {
                "type": "variable",
                "variableName": "Base",
                "metadata": {
                  "astVersion": "1.0.0",
                  "validationErrors": [],
                  "complexity": "low"
                }
              },
              "right": {
                "type": "function",
                "functionName": "Math.pow",
                "arguments": [
                  {
                    "type": "variable",
                    "variableName": "Ratio",
                    "metadata": {
                      "astVersion": "1.0.0",
                      "validationErrors": [],
                      "complexity": "low"
                    }
                  },
                  {
                    "type": "variable",
                    "variableName": "n",
                    "metadata": {
                      "astVersion": "1.0.0",
                      "validationErrors": [],
                      "complexity": "low"
                    }
                  }
                ],
                "metadata": {
                  "astVersion": "1.0.0",
                  "validationErrors": [],
                  "complexity": "medium"
                }
              },
              "metadata": {
                "astVersion": "1.0.0",
                "validationErrors": [],
                "complexity": "low"
              }
            }
          },
          "description": "Calculates font size based on modular scale",
          "variableIds": [
            "var_base",
            "var_ratio"
          ]
        }
      ],
      "conditions": [],
      "steps": [
        {
          "type": "formula",
          "id": "formula-typescale",
          "name": "Type Scale"
        }
      ]
    },
    {
      "id": "core-spacing-algorithm",
      "name": "Core Spacing Scale Algorithm",
      "description": "Calculates spacing based on exponential scale for core design system",
      "resolvedValueTypeId": "spacing",
      "variables": [
        {
          "id": "var_base_spacing",
          "name": "BaseSpacing",
          "type": "number",
          "defaultValue": "8"
        },
        {
          "id": "var_multiplier",
          "name": "Multiplier",
          "type": "number",
          "defaultValue": "1.5"
        }
      ],
      "formulas": [
        {
          "id": "formula-spacing",
          "name": "Spacing Scale",
          "expressions": {
            "latex": {
              "value": "\\mathit{BaseSpacing} \\times \\mathit{Multiplier}^{n}"
            },
            "javascript": {
              "value": "BaseSpacing * Math.pow(Multiplier, n)",
              "metadata": {
                "allowedOperations": [
                  "math"
                ]
              }
            },
            "ast": {
              "type": "binary",
              "operator": "*",
              "left": {
                "type": "variable",
                "variableName": "BaseSpacing",
                "metadata": {
                  "astVersion": "1.0.0",
                  "validationErrors": [],
                  "complexity": "low"
                }
              },
              "right": {
                "type": "function",
                "functionName": "Math.pow",
                "arguments": [
                  {
                    "type": "variable",
                    "variableName": "Multiplier",
                    "metadata": {
                      "astVersion": "1.0.0",
                      "validationErrors": [],
                      "complexity": "low"
                    }
                  },
                  {
                    "type": "variable",
                    "variableName": "n",
                    "metadata": {
                      "astVersion": "1.0.0",
                      "validationErrors": [],
                      "complexity": "low"
                    }
                  }
                ],
                "metadata": {
                  "astVersion": "1.0.0",
                  "validationErrors": [],
                  "complexity": "medium"
                }
              },
              "metadata": {
                "astVersion": "1.0.0",
                "validationErrors": [],
                "complexity": "low"
              }
            }
          },
          "description": "Calculates spacing based on exponential scale",
          "variableIds": [
            "var_base_spacing",
            "var_multiplier"
          ]
        }
      ],
      "conditions": [],
      "steps": [
        {
          "type": "formula",
          "id": "formula-spacing",
          "name": "Spacing Scale"
        }
      ]
    },
    {
      "id": "core-color-scale-algorithm",
      "name": "Core Color Scale Algorithm",
      "description": "Generates color scales based on HSL adjustments",
      "resolvedValueTypeId": "color",
      "variables": [
        {
          "id": "var_base_hue",
          "name": "BaseHue",
          "type": "number",
          "defaultValue": "210"
        },
        {
          "id": "var_saturation",
          "name": "Saturation",
          "type": "number",
          "defaultValue": "50"
        },
        {
          "id": "var_lightness_step",
          "name": "LightnessStep",
          "type": "number",
          "defaultValue": "10"
        }
      ],
      "formulas": [
        {
          "id": "formula-color-scale",
          "name": "Color Scale",
          "expressions": {
            "latex": {
              "value": "hsl(\\mathit{BaseHue}, \\mathit{Saturation}\\% , \\mathit{LightnessStep} \\times n\\%)"
            },
            "javascript": {
              "value": "`hsl(${BaseHue}, ${Saturation}%, ${LightnessStep * n}%)`",
              "metadata": {
                "allowedOperations": [
                  "math",
                  "color"
                ]
              }
            },
            "ast": {
              "type": "literal",
              "value": "`hsl(${BaseHue}, ${Saturation}%, ${LightnessStep * n}%)`",
              "metadata": {
                "astVersion": "1.0.0",
                "validationErrors": [],
                "complexity": "medium"
              }
            }
          },
          "description": "Generates color scale based on HSL adjustments",
          "variableIds": [
            "var_base_hue",
            "var_saturation",
            "var_lightness_step"
          ]
        }
      ],
      "conditions": [],
      "steps": [
        {
          "type": "formula",
          "id": "formula-color-scale",
          "name": "Color Scale"
        }
      ]
    }
  ],
  "execution": {
    "order": [
      "core-typescale-algorithm",
      "core-spacing-algorithm",
      "core-color-scale-algorithm"
    ],
    "parallel": false,
    "onError": "stop"
  },
  "integration": {
    "targetSchema": "https://designsystem.org/schemas/tokens/v1.0.0",
    "outputFormat": "design-tokens",
    "mergeStrategy": "merge",
    "validation": true
  }
}